content,title,channel
北京时间7月21日消息，2022年男篮亚洲杯在雅加达继续进行，新西兰队在1/4决赛中88-78击败韩国队，晋级四强。韩国队后卫线两员大将许勋和许雄分别因伤病和新冠缺阵，另外两名主将李大成和崔俊用在比赛中均累计两次技术犯规被罚下场。罗健儿为韩国队砍下19分14板3封盖，金钟奎13分3板，崔俊用11分9板7助攻，李大成11分，姜相载7分。新西兰队的卡梅隆得到22分9板8助攻，蒂明斯6分14板，米尔纳14分5板，法伦索恩16分7板，亨特8分4板，穆雷9分6板。根据赛程，新西兰队将在半决赛对阵澳大利亚队。,亚洲杯-韩国队两人被驱逐不敌新西兰 止步八强,体育
北京时间7月22日消息，CBA山东队官方宣布，与外援泰勒-罗切斯特完成签约。罗切斯特出生于美国休斯敦，今年37岁，身高1米85，体重88公斤，司职后卫。2021-2022赛季，他为天津队出战25场常规赛，场均出战30.8分钟能得到23.7分4.5篮板6.5助攻。季后赛两场比赛，罗切斯特场均出战31分钟，能得到12.5分1.5篮板9助攻2.5抢断。此前，CBA联盟公布了各俱乐部行使外援优先续约权的情况，天津队没有对罗切斯特使用优先续约权。山东队随后不久宣布与罗切斯特完成了签约。,山东队官宣签下罗切斯特 上赛季场均23+4+6,体育
7月20日，张可盈晒出一组夏日清爽写真，照片中张可盈一身纯白色抹胸连衣裙，长发披肩，发丝随风微微扬起，散发炎炎夏日的慵懒，可盐可甜，展现灵动气息。张可盈在刚刚收官的《幸福到万家》中饰演何幸运一角，动人的哭戏收获了观众的好评，期待她会带来更多优秀的作品。,张可盈夏日清爽写真 甜美少女气息与何幸运反差极大,明星
新浪娱乐讯 21日，柳岩最新一组时尚大片曝光。大片中，她身穿一袭黑纱裙，搭配黑色直发在月光下翩翩起舞，尽显轻盈灵动美，光影下好似古典月亮女神，氛围感拉满。,柳岩月下起舞大片氛围拉满 穿一袭黑纱裙尽显轻盈古典美,明星
新浪娱乐讯 据韩国媒体报道，男子组合NCT将出演时隔2年再次回归的《偶像运动会》。此前，NCT参加了《2020年偶运会春节特辑》，在男子射箭项目中获得了金牌。 由更加坚实的阵容组成的今年《偶运会》中NCT会有什么样的活跃表现，预计将成为看点之一。另外，今年中秋《偶运会》将在7月30日和8月1日进行为期两天的录制，在中秋连休期间播出。,《偶像运动会》时隔两年再办 男团NCT将参演竞技,音乐
